{
  "output": {
    "subject": "Update on iRoute",
    "body": "Hi Ada,\n\nThe first runtime milestone is working."
  },
  "resolutionLevel": "SmallModel",
  "confidence": 0.92,
  "evidence": [
    {
      "kind": "request",
      "reference": "input.activeDecisions",
      "contentHash": "d64f10a7d2f55ddfbfbc01da4436981de4450db4542138a699cdd6ef5e998a3f",
      "observedAt": null
    }
  ],
  "usage": {
    "inputTokens": 120,
    "outputTokens": 42,
    "cost": 0.01,
    "durationMilliseconds": 850,
    "modelCalls": 1,
    "toolCalls": 0
  },
  "artifacts": [
    {
      "artifactId": "0198f6b4-6f3c-7de1-86e8-5d223ab25451",
      "artifactType": "email.draft",
      "version": 1,
      "contentHash": "ab4b3f1e61a336a30753b4f7f130b5e77989d64e3205689947fa9e05d8e9920d"
    }
  ],
  "validation": {
    "passed": true,
    "quality": 0.92,
    "checks": ["output-schema", "quality-floor", "evidence-coverage"],
    "failures": []
  },
  "context": {
    "estimatedTokens": 18,
    "budgetTokens": 4000,
    "projectedInputTokens": 10,
    "contextTokens": 8,
    "truncated": false,
    "fullHistoryIncluded": false,
    "entries": [
      {
        "kind": "request",
        "reference": "input.activeDecisions[0]",
        "included": true,
        "reason": "Included after ranking, scope, freshness, supersession, deduplication, and budget checks.",
        "estimatedTokens": 18,
        "contentHash": "d64f10a7d2f55ddfbfbc01da4436981de4450db4542138a699cdd6ef5e998a3f",
        "rank": 950,
        "outputPath": "/activeDecisions/0"
      }
    ],
    "provenance": {
      "/activeDecisions/0": {
        "kind": "request",
        "reference": "input.activeDecisions[0]",
        "contentHash": "d64f10a7d2f55ddfbfbc01da4436981de4450db4542138a699cdd6ef5e998a3f",
        "observedAt": null
      }
    }
  },
  "routing": {
    "policyVersion": "routing.w08.v1",
    "path": "Direct",
    "reason": "The task requires one capability, so the direct path avoids the planning tax.",
    "selectedCapability": "text.generation",
    "selectedProfileId": "text.generation.small.eval-v1",
    "selectedModelTier": "Small",
    "qualityFloor": 0.8,
    "expectedQuality": 0.84,
    "expectedCost": 0.004,
    "expectedLatencyMilliseconds": 900,
    "uncertainty": 0.06,
    "score": 0.749,
    "plannerInvoked": false,
    "planningCalls": 0,
    "escalated": false,
    "escalationReason": null,
    "candidates": [
      {
        "capability": "text.generation",
        "profileId": "text.generation.small.eval-v1",
        "modelTier": "Small",
        "eligible": true,
        "reason": "eligible measured model profile",
        "expectedQuality": 0.84,
        "expectedCost": 0.004,
        "expectedLatencyMilliseconds": 900,
        "uncertainty": 0.06,
        "reliability": 0.98,
        "availability": 0.99,
        "score": 0.749
      },
      {
        "capability": "text.generation",
        "profileId": "text.generation.strong.eval-v1",
        "modelTier": "Strong",
        "eligible": true,
        "reason": "eligible measured model profile",
        "expectedQuality": 0.94,
        "expectedCost": 0.02,
        "expectedLatencyMilliseconds": 2200,
        "uncertainty": 0.03,
        "reliability": 0.99,
        "availability": 0.995,
        "score": 0.735
      }
    ]
  }
}
